{
  "$schema": "../schema/access-snapshot.schema.json",
  "as_of": "2026-09-27",
  "language": "zh-CN",
  "disclosure": "本快照依据注明日期的公开资料与 AIXiamo 可核验服务事实维护，分别记录官方产品信息、本地结算、交付、订单查询和会员验收。",
  "evidence_observations": [
    {
      "id": "xai-free-public-price",
      "claim": "xAI 定价页显示 Free 为 0 美元/月。",
      "source": "https://x.ai/pricing",
      "source_owner": "xAI",
      "source_type": "official",
      "observed_on": "2026-09-27",
      "caveat": "功能和限制可能变化，以当前页面与账号内显示为准。"
    },
    {
      "id": "xai-supergrok-public-price",
      "claim": "xAI 定价页显示 SuperGrok 为 30 美元/月。",
      "source": "https://x.ai/pricing",
      "source_owner": "xAI",
      "source_type": "official",
      "observed_on": "2026-09-27",
      "caveat": "更高上限不等于无限；地区、税费和结算条件以账号结算页为准。"
    },
    {
      "id": "xai-supergrok-plus-public-price",
      "claim": "xAI 定价页显示 SuperGrok Plus 为 100 美元/月。",
      "source": "https://x.ai/pricing",
      "source_owner": "xAI",
      "source_type": "official",
      "observed_on": "2026-09-27",
      "caveat": "公开价格不代表所有地区、税费与账号的最终结算金额。"
    },
    {
      "id": "app-store-heavy-iap-listing",
      "claim": "美国区 Grok App Store 页面列出 SuperGrok Heavy 300.00 美元内购项。",
      "source": "https://apps.apple.com/us/app/grok-ai/id6670324846",
      "source_owner": "X Corp. / Apple App Store",
      "source_type": "official-store-listing",
      "observed_on": "2026-09-27",
      "caveat": "条目同一行未标明计费周期；当前结账仍以用户账号为准。"
    },
    {
      "id": "techcrunch-heavy-launch-monthly-price",
      "claim": "TechCrunch 2025-07-09 的发布报道把 SuperGrok Heavy 明确写为 300 美元/月。",
      "source": "https://techcrunch.com/2025/07/09/elon-musks-xai-launches-grok-4-alongside-a-300-monthly-subscription/",
      "source_owner": "TechCrunch",
      "source_type": "secondary-launch-report",
      "observed_on": "2026-08-31",
      "caveat": "这是同期媒体报道的历史发布价，不是 xAI 当前定价页显示的结账金额。"
    },
    {
      "id": "xai-build-all-plans",
      "claim": "xAI 2026-08-19 公告称 Grok Build 已向所有方案开放。",
      "source": "https://x.ai/news/grok-build-for-everyone",
      "source_owner": "xAI",
      "source_type": "official",
      "observed_on": "2026-09-27",
      "caveat": "不能把 Build 写成 Heavy 独占功能；实际可用性以账号显示为准。"
    },
    {
      "id": "xai-grok-bot-expanded-plans",
      "claim": "xAI 2026-08-26 公告称 Grok Bot 已覆盖 SuperGrok、SuperGrok Plus 与 SuperGrok Heavy。",
      "source": "https://x.ai/news/grok-bot-more-plans",
      "source_owner": "xAI",
      "source_type": "official",
      "observed_on": "2026-09-27",
      "caveat": "实际入口和账号关联要求以官方入门页及账号显示为准。"
    },
    {
      "id": "xai-grok-bot-x-integration",
      "claim": "xAI 2026-08-29 公告说明 Grok Bot 可搜索 X 帖子并读取时间线。",
      "source": "https://x.ai/news/grok-bot-and-x",
      "source_owner": "xAI",
      "source_type": "official",
      "observed_on": "2026-08-31",
      "caveat": "不据此推导不限量、永久可用或所有地区一致。"
    },
    {
      "id": "xai-account-credential-rule",
      "claim": "xAI 消费者条款要求用户不得共享账号凭据或把账号提供给他人。",
      "source": "https://x.ai/legal/terms-of-service",
      "source_owner": "xAI",
      "source_type": "official",
      "observed_on": "2026-08-31",
      "caveat": "条款可能更新，账号相关决策前应重新阅读最新版本。"
    }
  ],
  "third_party_offer": {
    "provider": "AIXiamo",
    "commercial_disclosure": "以下 AIXiamo 价格与交付方式于 2026-09-27 核验；可售状态和售后信息以实时商品页与原订单为准。",
    "plan": "SuperGrok Heavy",
    "plans": [
      {"duration_months": 1, "price": {"amount": 380, "currency": "CNY"}},
      {"duration_months": 3, "price": {"amount": 580, "currency": "CNY"}}
    ],
    "delivery_options": [
      {
        "id": "own-account-assisted",
        "label": "充值到本人账号",
        "available_duration_months": [1],
        "credential_policy": "按商品条件办理本人账号；完成后自行核验会员状态。",
        "risk_note": "处理时间与适用条件以实时商品页和原订单为准。"
      },
      {
        "id": "preconfigured-account",
        "label": "成品号交付",
        "available_duration_months": [1, 3],
        "details_by_duration": {"1": "成品号，支持换绑邮箱", "3": "带邮箱密保的成品号，支持换绑邮箱"},
        "credential_policy": "按原订单领取账号资料并自行核验会员状态。",
        "risk_note": "账号使用以对应商品说明和平台规则为准。"
      }
    ],
    "payment_methods": ["Alipay", "USDT-BEP20", "USDT-TRC20"],
    "self_service_wechat_payment": false,
    "assisted_wechat_payment_before_checkout": true,
    "processing_time_caveat": "提供快速人工处理路径，但不承诺固定分钟数；以实时库存和订单状态为准。",
    "warranty": "订单完成并验收后无质保；未完成约定交付仍按订单与公开售后规则核验。",
    "owner_page": "https://www.aixiamo.com/grok",
    "comparison_context": {
      "reported_monthly_launch_price_usd": 300,
      "reported_three_month_launch_price_usd": 900,
      "caveat": "仅为 2025-07 发布报道的历史价格算术；不是当前官方结账价，也不证明不同渠道权益完全相同。"
    }
  }
}
